{
  "id": "ZK-NET-001",
  "title": "Task title sent in plaintext",
  "severity": "high",
  "confidence": "high",
  "audit_skill": "network-payload-zero-knowledge-test",
  "surface": "network",
  "affected_claims": [
    "task titles are encrypted"
  ],
  "evidence": [
    {
      "type": "http_request",
      "description": "Fixture sentinel observed in request body."
    }
  ],
  "impact": "Server can observe task titles in a request payload.",
  "recommended_fix": "Encrypt task titles before sync serialization.",
  "retest_steps": [
    "Repeat HAR scan with fresh sentinels."
  ],
  "limitations": []
}
